{
  "schema_version": "1.0.0",
  "decision_case_id": "dc-2026-09-25-0001",
  "org_id": "org_acme",
  "plant_id": "plant_ghaziabad_1",
  "lockfile_hash": "sha256:aaaaaaaaaaaaaaaaaaaaaaaaaaaaaaaaaaaaaaaaaaaaaaaaaaaaaaaaaaaaaaaa",
  "kernel_version": "l4-kernel.v1",
  "correlation_id": "corr-2026-09-25-0001",
  "origin": "l3_finding",
  "state": "terminal",
  "condition_key": "ck:md_overlap:incomer_1:2026-06-15T06:00:00Z/2026-06-15T07:00:00Z",
  "finding_refs": ["f-2026-07-08-0042"],
  "detector_id": "det.md_overlap",
  "detector_version": "1.0.0",
  "decision_family_id": "fam.md_coincidence",
  "primary_domain_id": "dom.energy_cost",
  "psm_snapshot_id": "psm-2026-09-25T04:00:00Z",
  "decision_trace_id": "dt-2026-09-25-0001",
  "card_proposal_id": "cp-2026-09-25-0001",
  "emit_idempotency_key": "dc-2026-09-25-0001:emit:sha256:bbbbbbbbbbbbbbbbbbbbbbbbbbbbbbbbbbbbbbbbbbbbbbbbbbbbbbbbbbbbbbbb",
  "terminal": "emit",
  "attempt": 0,
  "created_at": "2026-09-25T04:00:00Z",
  "updated_at": "2026-09-25T04:02:11Z"
}
